Polarised modular conglomeration;http://python.beispiel.programmierenlernen.io/img/1.jpg;Optio numquam ut accusantium laborum unde assumenda. Ea et totam asperiores fugiat voluptatem vitae. Et provident nam et mollitia.
Cross-group contextually-based middleware;http://python.beispiel.programmierenlernen.io/img/2.jpg;Deleniti atque autem et commodi cupiditate cupiditate. Fuga illum quas aliquam velit. Labore dolor fugit quia id odio nam.
De-engineered encompassing structure;http://python.beispiel.programmierenlernen.io/img/3.jpg;Assumenda tempora inventore harum cumque voluptatibus sit et. Et omnis et dolore quod voluptas sit a.
Fully-configurable multi-tasking interface;http://python.beispiel.programmierenlernen.io/img/4.jpg;Cumque unde officia autem quia at fugit. Sint iure veritatis culpa aut provident aliquam in. Eos eum accusantium quia vel dignissimos nesciunt expedita. Rem aut accusantium et tempore.
Versatile eco-centric core;http://python.beispiel.programmierenlernen.io/img/5.jpg;Delectus distinctio quis omnis ut commodi sed. Beatae officia doloribus consequatur dolore. Consectetur impedit quia voluptas et ut. Incidunt rem mollitia fugiat quia corporis quo. Quod possimus ut et neque deserunt.
Optional maximized utilisation;http://python.beispiel.programmierenlernen.io/img/6.jpg;Consequatur sit deleniti sunt aut ullam eos. Vel ex ut sunt velit provident corporis consequatur. Ea est dolorum ut atque unde. Quasi itaque nihil pariatur.
Open-architected secondary product;http://python.beispiel.programmierenlernen.io/img/7.jpg;Reiciendis dolor quisquam tempora in. Totam ut distinctio vero. Ullam maiores dolor sunt voluptas.
Realigned zerotolerance function;http://python.beispiel.programmierenlernen.io/img/8.jpg;Consectetur doloribus sed quia id ex sequi. Accusamus repudiandae esse incidunt sunt minima sapiente quibusdam. Sit eius quasi non eius.
